### ISSUE TITLE
SIA Plugin seems not to digest my messages

### ISSUE THREAD

**Issue by thekoma** [home-assistant/home-assistant.github.io#21253]
### Feedback

The plugin seems not using correctly the messages:

```
homeassistant    | 2022-01-19 18:22:36 WARNING (MainThread) [pysiaalarm.base_server] Event timestamp is no longer valid: 2022-01-19 17:55:01+00:00
homeassistant    | 2022-01-19 18:22:54 DEBUG (MainThread) [pysiaalarm.base_server] Incoming line: 63B40050"SIA-DCS"1660L0#000110[#000110|Nri0RP2^SL 1807110200065423^]_17:55:01,01-19-2022
homeassistant    | 2022-01-19 18:22:54 DEBUG (MainThread) [pysiaalarm.event] Content matches: {'account': '000110', 'ti': None, 'id': None, 'ri': '0', 'code': 'RP', 'message': '2^SL 1807110200065423^', 'xdata': None, 'timestamp': '17:55:01,01-19-2022'}
homeassistant    | 2022-01-19 18:22:54 WARNING (MainThread) [pysiaalarm.base_server] Event timestamp is no longer valid: 2022-01-19 17:55:01+00:00
homeassistant    | 2022-01-19 18:23:18 DEBUG (MainThread) [pysiaalarm.base_server] Incoming line: 593B005F"SIA-DCS"1660L0#000110[#000110|Nri1BA503^Volum.Taverna   Appartam.Giorno ^]_17:55:48,01-19-2022
homeassistant    | 2022-01-19 18:23:18 DEBUG (MainThread) [pysiaalarm.event] Content matches: {'account': '000110', 'ti': None, 'id': None, 'ri': '1', 'code': 'BA', 'message': '503^Volum.Taverna   Appartam.Giorno ^', 'xdata': None, 'timestamp': '17:55:48,01-19-2022'}
homeassistant    | 2022-01-19 18:23:18 WARNING (MainThread) [pysiaalarm.base_server] Event timestamp is no longer valid: 2022-01-19 17:55:48+00:00
homeassistant    | 2022-01-19 18:23:36 DEBUG (MainThread) [pysiaalarm.base_server] Incoming line: 593B005F"SIA-DCS"1660L0#000110[#000110|Nri1BA503^Volum.Taverna   Appartam.Giorno ^]_17:55:48,01-19-2022
homeassistant    | 2022-01-19 18:23:36 DEBUG (MainThread) [pysiaalarm.event] Content matches: {'account': '000110', 'ti': None, 'id': None, 'ri': '1', 'code': 'BA', 'message': '503^Volum.Taverna   Appartam.Giorno ^', 'xdata': None, 'timestamp': '17:55:48,01-19-2022'}
homeassistant    | 2022-01-19 18:23:36 WARNING (MainThread) [pysiaalarm.base_server] Event timestamp is no longer valid: 2022-01-19 17:55:48+00:00
homeassistant    | 2022-01-19 18:23:54 DEBUG (MainThread) [pysiaalarm.base_server] Incoming line: 593B005F"SIA-DCS"1660L0#000110[#000110|Nri1BA503^Volum.Taverna   Appartam.Giorno ^]_17:55:48,01-19-2022
homeassistant    | 2022-01-19 18:23:54 DEBUG (MainThread) [pysiaalarm.event] Content matches: {'account': '000110', 'ti': None, 'id': None, 'ri': '1', 'code': 'BA', 'message': '503^Volum.Taverna   Appartam.Giorno ^', 'xdata': None, 'timestamp': '17:55:48,01-19-2022'}
homeassistant    | 2022-01-19 18:23:54 WARNING (MainThread) [pysiaalarm.base_server] Event timestamp is no longer valid: 2022-01-19 17:55:48+00:00
homeassistant    | 2022-01-19 18:24:12 DEBUG (MainThread) [pysiaalarm.base_server] Incoming line: 593B005F"SIA-DCS"1660L0#000110[#000110|Nri1BA503^Volum.Taverna   Appartam.Giorno ^]_17:55:48,01-19-2022
homeassistant    | 2022-01-19 18:24:12 DEBUG (MainThread) [pysiaalarm.event] Content matches: {'account': '000110', 'ti': None, 'id': None, 'ri': '1', 'code': 'BA', 'message': '503^Volum.Taverna   Appartam.Giorno ^', 'xdata': None, 'timestamp': '17:55:48,01-19-2022'}
homeassistant    | 2022-01-19 18:24:12 WARNING (MainThread) [pysiaalarm.base_server] Event timestamp is no longer valid: 2022-01-19 17:55:48+00:00
homeassistant    | 2022-01-19 18:24:36 DEBUG (MainThread) [pysiaalarm.base_server] Incoming line: 1128005F"SIA-DCS"1660L0#000110[#000110|Nri1BR503^Volum.Taverna   Appartam.Giorno ^]_17:55:50,01-19-2022
homeassistant    | 2022-01-19 18:24:36 DEBUG (MainThread) [pysiaalarm.event] Content matches: {'account': '000110', 'ti': None, 'id': None, 'ri': '1', 'code': 'BR', 'message': '503^Volum.Taverna   Appartam.Giorno ^', 'xdata': None, 'timestamp': '17:55:50,01-19-2022'}
homeassistant    | 2022-01-19 18:24:36 WARNING (MainThread) [pysiaalarm.base_server] Event timestamp is no longer valid: 2022-01-19 17:55:50+00:00
homeassistant    | 2022-01-19 18:24:54 DEBUG (MainThread) [pysiaalarm.base_server] Incoming line: 1128005F"SIA-DCS"1660L0#000110[#000110|Nri1BR503^Volum.Taverna   Appartam.Giorno ^]_17:55:50,01-19-2022
homeassistant    | 2022-01-19 18:24:54 DEBUG (MainThread) [pysiaalarm.event] Content matches: {'account': '000110', 'ti': None, 'id': None, 'ri': '1', 'code': 'BR', 'message': '503^Volum.Taverna   Appartam.Giorno ^', 'xdata': None, 'timestamp': '17:55:50,01-19-2022'}
homeassistant    | 2022-01-19 18:24:54 WARNING (MainThread) [pysiaalarm.base_server] Event timestamp is no longer valid: 2022-01-19 17:55:50+00:00
homeassistant    | 2022-01-19 18:25:12 DEBUG (MainThread) [pysiaalarm.base_server] Incoming line: 1128005F"SIA-DCS"1660L0#000110[#000110|Nri1BR503^Volum.Taverna   Appartam.Giorno ^]_17:55:50,01-19-2022
homeassistant    | 2022-01-19 18:25:12 DEBUG (MainThread) [pysiaalarm.event] Content matches: {'account': '000110', 'ti': None, 'id': None, 'ri': '1', 'code': 'BR', 'message': '503^Volum.Taverna   Appartam.Giorno ^', 'xdata': None, 'timestamp': '17:55:50,01-19-2022'}
homeassistant    | 2022-01-19 18:25:12 WARNING (MainThread) [pysiaalarm.base_server] Event timestamp is no longer valid: 2022-01-19 17:55:50+00:00
homeassistant    | 2022-01-19 18:25:30 DEBUG (MainThread) [pysiaalarm.base_server] Incoming line: 1128005F"SIA-DCS"1660L0#000110[#000110|Nri1BR503^Volum.Taverna   Appartam.Giorno ^]_17:55:50,01-19-2022
homeassistant    | 2022-01-19 18:25:30 DEBUG (MainThread) [pysiaalarm.event] Content matches: {'account': '000110', 'ti': None, 'id': None, 'ri': '1', 'code': 'BR', 'message': '503^Volum.Taverna   Appartam.Giorno ^', 'xdata': None, 'timestamp': '17:55:50,01-19-2022'}
homeassistant    | 2022-01-19 18:25:30 WARNING (MainThread) [pysiaalarm.base_server] Event timestamp is no longer valid: 2022-01-19 17:55:50+00:00
homeassistant    | 2022-01-19 18:25:54 DEBUG (MainThread) [pysiaalarm.base_server] Incoming line: 24810050"SIA-DCS"1660L0#000110[#000110|Nri0RP2^SL 1807110200065423^]_18:00:01,01-19-2022
homeassistant    | 2022-01-19 18:25:54 DEBUG (MainThread) [pysiaalarm.event] Content matches: {'account': '000110', 'ti': None, 'id': None, 'ri': '0', 'code': 'RP', 'message': '2^SL 1807110200065423^', 'xdata': None, 'timestamp': '18:00:01,01-19-2022'}
homeassistant    | 2022-01-19 18:25:54 WARNING (MainThread) [pysiaalarm.base_server] Event timestamp is no longer valid: 2022-01-19 18:00:01+00:00
homeassistant    | 2022-01-19 18:26:12 DEBUG (MainThread) [pysiaalarm.base_server] Incoming line: 24810050"SIA-DCS"1660L0#000110[#000110|Nri0RP2^SL 1807110200065423^]_18:00:01,01-19-2022
homeassistant    | 2022-01-19 18:26:12 DEBUG (MainThread) [pysiaalarm.event] Content matches: {'account': '000110', 'ti': None, 'id': None, 'ri': '0', 'code': 'RP', 'message': '2^SL 1807110200065423^', 'xdata': None, 'timestamp': '18:00:01,01-19-2022'}
homeassistant    | 2022-01-19 18:26:12 WARNING (MainThread) [pysiaalarm.base_server] Event timestamp is no longer valid: 2022-01-19 18:00:01+00:00
homeassistant    | 2022-01-19 18:26:30 DEBUG (MainThread) [pysiaalarm.base_server] Incoming line: 24810050"SIA-DCS"1660L0#000110[#000110|Nri0RP2^SL 1807110200065423^]_18:00:01,01-19-2022
homeassistant    | 2022-01-19 18:26:30 DEBUG (MainThread) [pysiaalarm.event] Content matches: {'account': '000110', 'ti': None, 'id': None, 'ri': '0', 'code': 'RP', 'message': '2^SL 1807110200065423^', 'xdata': None, 'timestamp': '18:00:01,01-19-2022'}
homeassistant    | 2022-01-19 18:26:30 WARNING (MainThread) [pysiaalarm.base_server] Event timestamp is no longer valid: 2022-01-19 18:00:01+00:00
homeassistant    | 2022-01-19 18:26:51 DEBUG (MainThread) [pysiaalarm.base_server] Incoming line: 24810050"SIA-DCS"1660L0#000110[#000110|Nri0RP2^SL 1807110200065423^]_18:00:01,01-19-2022
homeassistant    | 2022-01-19 18:26:51 DEBUG (MainThread) [pysiaalarm.event] Content matches: {'account': '000110', 'ti': None, 'id': None, 'ri': '0', 'code': 'RP', 'message': '2^SL 1807110200065423^', 'xdata': None, 'timestamp': '18:00:01,01-19-2022'}
homeassistant    | 2022-01-19 18:26:51 WARNING (MainThread) [pysiaalarm.base_server] Event timestamp is no longer valid: 2022-01-19 18:00:01+00:00
homeassistant    | 2022-01-19 18:27:15 DEBUG (MainThread) [pysiaalarm.base_server] Incoming line: 27440050"SIA-DCS"1660L0#000110[#000110|Nri0RP2^SL 1807110200065423^]_18:05:01,01-19-2022
homeassistant    | 2022-01-19 18:27:15 DEBUG (MainThread) [pysiaalarm.event] Content matches: {'account': '000110', 'ti': None, 'id': None, 'ri': '0', 'code': 'RP', 'message': '2^SL 1807110200065423^', 'xdata': None, 'timestamp': '18:05:01,01-19-2022'}
homeassistant    | 2022-01-19 18:27:15 WARNING (MainThread) [pysiaalarm.base_server] Event timestamp is no longer valid: 2022-01-19 18:05:01+00:00
homeassistant    | 2022-01-19 18:27:33 DEBUG (MainThread) [pysiaalarm.base_server] Incoming line: 27440050"SIA-DCS"1660L0#000110[#000110|Nri0RP2^SL 1807110200065423^]_18:05:01,01-19-2022
homeassistant    | 2022-01-19 18:27:33 DEBUG (MainThread) [pysiaalarm.event] Content matches: {'account': '000110', 'ti': None, 'id': None, 'ri': '0', 'code': 'RP', 'message': '2^SL 1807110200065423^', 'xdata': None, 'timestamp': '18:05:01,01-19-2022'}
homeassistant    | 2022-01-19 18:27:33 WARNING (MainThread) [pysiaalarm.base_server] Event timestamp is no longer valid: 2022-01-19 18:05:01+00:00
homeassistant    | 2022-01-19 18:27:51 DEBUG (MainThread) [pysiaalarm.base_server] Incoming line: 27440050"SIA-DCS"1660L0#000110[#000110|Nri0RP2^SL 1807110200065423^]_18:05:01,01-19-2022
homeassistant    | 2022-01-19 18:27:51 DEBUG (MainThread) [pysiaalarm.event] Content matches: {'account': '000110', 'ti': None, 'id': None, 'ri': '0', 'code': 'RP', 'message': '2^SL 1807110200065423^', 'xdata': None, 'timestamp': '18:05:01,01-19-2022'}
homeassistant    | 2022-01-19 18:27:51 WARNING (MainThread) [pysiaalarm.base_server] Event timestamp is no longer valid: 2022-01-19 18:05:01+00:00
homeassistant    | 2022-01-19 18:28:05 WARNING (MainThread) [asyncio] Executing <Task finished name='Task-7032' coro=<_handle_async_response() done, defined at /usr/src/homeassistant/homeassistant/components/websocket_api/decorators.py:19> result=None created at /usr/local/lib/python3.9/asyncio/tasks.py:361> took 0.158 seconds
```

I'm not able to understand how to decode the messages to understand if something is missing or simply unexpected

### URL

https://www.home-assistant.io/integrations/sia/

### Version

2021.12.10

**Comment by eavanvalkenburg** [comment]
Please use the config to set the flag for extended timestamps, that should fix it for now!

**Comment by thekoma** [comment]
The logs are already with this setting enabled.

Il mer 19 gen 2022, 18:36 Eduard van Valkenburg ***@***.***>
ha scritto:

**Comment by eavanvalkenburg** [comment]
I'm not talking about logs, in the Integrations screen go to the sia integration and then click Configure and enable the Ignore the timestamps setting.

**Comment by thekoma** [comment]
@eavanvalkenburg sorry I've messed up my previous message. the setting is already enabled:
![image](https://user-images.githubusercontent.com/247170/150334149-f15fc286-a352-4bc4-b751-7e9ffe620aa0.png)

To be sure I've checked also that the setting is actually saved into the configuration:
```json
{
  "entry_id": "1ee2a23f6e6d37c8e9bc6cff6d924f8e",
  "version": 1,
  "domain": "sia",
  "title": "SIA Alarm on port 6001",
  "data": {
    "port": 6001,
    "protocol": "TCP",
    "accounts": [
      {
        "account": "000110",
        "encryption_key": null,
        "ping_interval": 20
      }
    ]
  },
  "options": {
    "accounts": {
      "000110": {
        "ignore_timestamps": true,
        "zones": 1000
      }
    }
  },
  "pref_disable_new_entities": false,
  "pref_disable_polling": false,
  "source": "user",
  "unique_id": null,
  "disabled_by": null
}
```

I've dumped a little of the code and seems that I'm are actively replying NAK to these messages:

```pcap
01CD005F"SIA-DCS"1783L0#000110[#000110|Nri1BA503^Volum.Taverna   Appartam.Giorno ^]_11:49:27,01-20-2022
12:17:25.855261 IP 192.168.85.20.8247 > 172.21.0.2.6001: Flags [P.], seq 1:106, ack 1, win 2048, length 105
E.....@...6...U..... 7.qeo..u.=.P...\...
01CD005F"SIA-DCS"1783L0#000110[#000110|Nri1BA503^Volum.Taverna   Appartam.Giorno ^]_11:49:27,01-20-2022
12:17:25.855267 IP 192.168.85.20.8247 > 172.21.0.2.6001: Flags [P.], seq 1:106, ack 1, win 2048, length 105
E.....@...6...U..... 7.qeo..u.=.P...\...
01CD005F"SIA-DCS"1783L0#000110[#000110|Nri1BA503^Volum.Taverna   Appartam.Giorno ^]_11:49:27,01-20-2022
12:17:25.855287 IP 172.21.0.2.6001 > 192.168.85.20.8247: Flags [.], ack 106, win 29200, length 0
E..(..@.@..o......U..q 7u.=.eo.aP.r.....
12:17:25.855287 IP 172.21.0.2.6001 > 192.168.85.20.8247: Flags [.], ack 106, win 29200, length 0
E..(..@.@..o......U..q 7u.=.eo.aP.r.....
12:17:25.855305 IP 192.168.85.11.6001 > 192.168.85.20.8247: Flags [.], ack 106, win 29200, length 0
E..(..@.?.....U...U..q 7u.=.eo.aP.r.+...
12:17:25.859231 IP 172.21.0.2.6001 > 192.168.85.20.8247: Flags [P.], seq 1:48, ack 106, win 29200, length 47
E..W..@.@..?......U..q 7u.=.eo.aP.r.....
69260025"NAK"0000R0L0A0[]_11:17:25,01-20-2022
12:17:25.859231 IP 172.21.0.2.6001 > 192.168.85.20.8247: Flags [P.], seq 1:48, ack 106, win 29200, length 47
E..W..@.@..?......U..q 7u.=.eo.aP.r.....
69260025"NAK"0000R0L0A0[]_11:17:25,01-20-2022
12:17:25.859273 IP 192.168.85.11.6001 > 192.168.85.20.8247: Flags [P.], seq 1:48, ack 106, win 29200, length 47
E..W..@.?.....U...U..q 7u.=.eo.aP.r.+...
69260025"NAK"0000R0L0A0[]_11:17:25,01-20-2022
12:17:26.060733 IP 172.21.0.2.6001 > 192.168.85.20.8247: Flags [P.], seq 1:48, ack 106, win 29200, length 47
E..W..@.@..>......U..q 7u.=.eo.aP.r.....
69260025"NAK"0000R0L0A0[]_11:17:25,01-20-2022
12:17:26.060733 IP 172.21.0.2.6001 > 192.168.85.20.8247: Flags [P.], seq 1:48, ack 106, win 29200, length 47
E..W..@.@..>......U..q 7u.=.eo.aP.r.....
69260025"NAK"0000R0L0A0[]_11:17:25,01-20-2022
12:17:26.060797 IP 192.168.85.11.6001 > 192.168.85.20.8247: Flags [P.], seq 1:48, ack 106, win 29200, length 47
E..W..@.?.....U...U..q 7u.=.eo.aP.r.+...
69260025"NAK"0000R0L0A0[]_11:17:25,01-20-2022
12:17:26.060977 IP 192.168.85.20.8247 > 192.168.85.11.6001: Flags [.], ack 48, win 2048, length 0
E..(..@.......U...U. 7.qeo.au.>.P.............
12:17:26.061001 IP 192.168.85.20.8247 > 172.21.0.2.6001: Flags [.], ack 48, win 2048, length 0
E..(..@...7c..U..... 7.qeo.au.>.P....v..
12:17:26.061007 IP 192.168.85.20.8247 > 172.21.0.2.6001: Flags [.], ack 48, win 2048, length 0
E..(..@...7c..U..... 7.qeo.au.>.P....v..
```
